<?xml version="1.0" encoding="UTF-8"?>
<!DOCTYPE cv SYSTEM "cv.dtd">
<cv>
  <personal_info>
    <name>Okba Adam</name>
    <email>Adamokba02@outlook.fr</email>
    <phone>07 81 01 22 82</phone>
    <address>5 Avenue Léon Blum, 93800 Épinay-sur-seine, France</address>
  </personal_info>

  <language code="fr">
    <title>CV – Okba Adam</title>
    <description>Développeur et ingénieur cybersécurité en formation</description>
    <display_name>Okba Adam</display_name>
    
    <skills>
      <skill>HTML5/CSS</skill>
      <skill>Python</skill>
      <skill>OCaml</skill>
      <skill>Java</skill>
      <skill>C</skill>
      <skill>Unix</skill>
      <skill>Java Swing</skill>
      <skill>OCaml unification</skill>
      <skill>Client-serveur C</skill>
    </skills>
    
    <soft_skills>
      <soft_skill>Rigoureux</soft_skill>
      <soft_skill>Polyvalent</soft_skill>
      <soft_skill>Déterminé</soft_skill>
    </soft_skills>
    
    <interests>
      <interest>Nouvelle technologie</interest>
      <interest>Natation</interest>
      <interest>Voyage</interest>
    </interests>
    
    <languages>
      <language_skill>Anglais (Avancé)</language_skill>
      <language_skill>Japonais (Intermédiaire)</language_skill>
      <language_skill>Allemand (Débutant)</language_skill>
    </languages>
    
    <education>
      <degree>Diplôme Ingénieur – Sup Galilée – 2023–2026</degree>
      <degree>Licence Informatique – Institut Galilée – 2021–2023</degree>
      <degree>CPGE MPSI – Lycée Gustave Monod – 2020–2021</degree>
      <degree>Baccalauréat SSI – Lycée Jacques Feyder – 2020 – Mention Bien</degree>
    </education>
    
    <experience>
      <job>Stagiaire – SFR – Janvier 2016 / Février 2016</job>
    </experience>
    
    <projects>
      <project>Conception d'un jeu en Java (Swing)</project>
      <project>Algorithmes d'unification OCaml</project>
      <project>Client-serveur en C</project>
    </projects>
  </language>

  <language code="ja">
    <title>履歴書 – オクバ・アダム</title>
    <description>サイバーセキュリティ分野での訓練中の開発者・エンジニア</description>
    <display_name>オクバ・アダム</display_name>
    
    <skills>
      <skill>HTML5/CSS</skill>
      <skill>Python</skill>
      <skill>OCaml</skill>
      <skill>Java</skill>
      <skill>C</skill>
      <skill>Unix</skill>
      <skill>Java Swing</skill>
      <skill>OCaml 一致アルゴリズム</skill>
      <skill>クライアント・サーバ C</skill>
    </skills>
    
    <soft_skills>
      <soft_skill>几帳面</soft_skill>
      <soft_skill>多才</soft_skill>
      <soft_skill>意欲的</soft_skill>
    </soft_skills>
    
    <interests>
      <interest>新技術</interest>
      <interest>水泳</interest>
      <interest>旅行</interest>
    </interests>
    
    <languages>
      <language_skill>英語（上級）</language_skill>
      <language_skill>日本語（中級）</language_skill>
      <language_skill>ドイツ語（初級）</language_skill>
    </languages>
    
    <education>
      <degree>エンジニアディプロム – Sup Galilée – 2023–2026</degree>
      <degree>情報学学士 – Institut Galilée – 2021–2023</degree>
      <degree>CPGE MPSI – Gustave Monod高校 – 2020–2021</degree>
      <degree>高校卒業証書 SSI – Jacques Feyder高校 – 2020 – 優良</degree>
    </education>
    
    <experience>
      <job>インターン – SFR – 2016年1月 / 2016年2月</job>
    </experience>
    
    <projects>
      <project>Java（Swing）によるゲーム設計</project>
      <project>OCaml の一致アルゴリズム</project>
      <project>C によるクライアント・サーバ</project>
    </projects>
  </language>

  <language code="en">
    <title>CV – Okba Adam</title>
    <description>Developer and aspiring cybersecurity engineer</description>
    <display_name>Okba Adam</display_name>
    
    <skills>
      <skill>HTML5/CSS</skill>
      <skill>Python</skill>
      <skill>OCaml</skill>
      <skill>Java</skill>
      <skill>C</skill>
      <skill>Unix</skill>
      <skill>Java Swing</skill>
      <skill>OCaml unification</skill>
      <skill>Client-Server in C</skill>
    </skills>
    
    <soft_skills>
      <soft_skill>Reliable</soft_skill>
      <soft_skill>Versatile</soft_skill>
      <soft_skill>Determined</soft_skill>
    </soft_skills>
    
    <interests>
      <interest>New technologies</interest>
      <interest>Swimming</interest>
      <interest>Travel</interest>
    </interests>
    
    <languages>
      <language_skill>English (Advanced)</language_skill>
      <language_skill>Japanese (Intermediate)</language_skill>
      <language_skill>German (Beginner)</language_skill>
    </languages>
    
    <education>
      <degree>Graduate engineer – Sup Galilée – 2023–2026</degree>
      <degree>Bachelor of Computer Science – Institut Galilée – 2021–2023</degree>
      <degree>CPGE MPSI – Lycée Gustave Monod – 2020–2021</degree>
      <degree>High school diploma IT – Lycée Jacques Feyder – 2020 – Good</degree>
    </education>
    
    <experience>
      <job>Intern – SFR – January 2016 / February 2016</job>
    </experience>
    
    <projects>
      <project>Developing a game with Java (Swing)</project>
      <project>Unification algorithms in OCaml</project>
      <project>Client-server architecture in C</project>
    </projects>
  </language>

  <titles>
    <title_set lang="fr">
      <title_item key="Compétences">Compétences</title_item>
      <title_item key="Langues">Langues</title_item>
      <title_item key="Soft Skills">Soft Skills</title_item>
      <title_item key="Centres d'intérêt">Centres d'intérêt</title_item>
      <title_item key="Formation">Formation</title_item>
      <title_item key="Expérience professionnelle">Expérience professionnelle</title_item>
      <title_item key="Projets informatiques">Projets informatiques</title_item>
      <title_item key="Présentation vidéo">Présentation vidéo</title_item>
    </title_set>
    
    <title_set lang="ja">
      <title_item key="Compétences">スキル</title_item>
      <title_item key="Langues">言語</title_item>
      <title_item key="Soft Skills">ソフトスキル</title_item>
      <title_item key="Centres d'intérêt">趣味・関心</title_item>
      <title_item key="Formation">学歴</title_item>
      <title_item key="Expérience professionnelle">職務経験</title_item>
      <title_item key="Projets informatiques">情報プロジェクト</title_item>
      <title_item key="Présentation vidéo">ビデオ紹介</title_item>
    </title_set>
    
    <title_set lang="en">
      <title_item key="Compétences">Skills</title_item>
      <title_item key="Langues">Languages</title_item>
      <title_item key="Soft Skills">Soft skills</title_item>
      <title_item key="Centres d'intérêt">Interests</title_item>
      <title_item key="Formation">Education</title_item>
      <title_item key="Expérience professionnelle">Work experience</title_item>
      <title_item key="Projets informatiques">IT Projects</title_item>
      <title_item key="Présentation vidéo">Video introduction</title_item>
    </title_set>
  </titles>
</cv>